{
    "$schema": "./schema.json",
    "code": "en",
    "name": "English (Global)",
    "order": 0,
    "strings": {
        "Subtitle": "Edit PSO2 AQP/AQN models and character shapes",
        "OpenModels": "Open model files…",
        "GameDataHeader": "Game Data / Model Search",
        "SelectGameFolder": "Select game folder…",
        "RefreshCache": "Refresh cache",
        "DataFolderUnspecified": "Data folder not selected",
        "DataFolderHelp": "Select the game installation folder, pso2_bin, or data folder.",
        "SearchPlaceholder": "Name · ID · file name · MD5",
        "Search": "Search",
        "LoadSelectedModel": "Load selected model",
        "ShapeSliders": "Shape Sliders · S / P / R",
        "LoadCharacter": "Load character file…",
        "LoadAqm": "Load _sa.aqm…",
        "ResetShape": "Reset shape",
        "SaveAqm": "Save _sa.aqm…",
        "CameraHelp": "L/R drag: rotate   Ctrl+drag: move vertically   Middle click: reset view   Wheel: zoom",
        "Ready": "Ready",
        "Statistics": "Models {0:N0} · Vertices {1:N0} · Triangles {2:N0} · Textures {3:N0} · {4:F1} fps",
        "Scale": "Scale (S)",
        "Position": "Position (P)",
        "Rotation": "Rotation (R)",
        "ModelPickerTitle": "Open PSO2 model files",
        "ModelPickerType": "PSO2 model / skeleton / ICE",
        "GameFolderPickerTitle": "Select the PSO2 game installation folder",
        "SearchResultCount": "{0:N0} search results",
        "ModelSearchFailed": "Model search failed: {0}",
        "WearBasewear": "Basewear",
        "WearOuterwear": "Outerwear",
        "WearSetwear": "Setwear",
        "WearCostume": "Costume (classic)",
        "BackgroundTip": "Viewport background",
        "FloorGuide": "Floor guide",
        "FloorGuideTip": "Show the world Y=0 floor guide",
        "Ornaments": "Ornaments",
        "OrnamentsTip": "Show or hide toggleable outfit ornament meshes",
        "BasewearOrnament1": "Basewear Ornament 1",
        "BasewearOrnament2": "Basewear Ornament 2",
        "OuterwearOrnament": "Outerwear Ornament",
        "BackgroundDark": "Dark",
        "BackgroundGraphite": "Graphite",
        "BackgroundGray": "Gray",
        "BackgroundSilver": "Silver",
        "BackgroundWhite": "White",
        "BackgroundNavy": "Navy",
        "BackgroundForest": "Forest",
        "BackgroundMagenta": "Magenta",
        "DataPathValid": "PSO2 game data path verified.",
        "CacheReadyInline": "Game data verified · {0:N0} cached items ready",
        "CacheReadyStatus": "Model cache ready: {0:N0} items",
        "DataPrepareFailedInline": "The game data path is valid, but settings or cache preparation failed: {0}",
        "DataPrepareFailedStatus": "Game data preparation failed: {0}",
        "CacheUnavailable": "The cache cannot be refreshed: {0}",
        "Refreshing": "Refreshing…",
        "CacheBuildingStatus": "Building the CMX model cache…",
        "CacheBuildingInline": "Game data verified · refreshing the model cache…",
        "CacheCompletedInline": "Game data verified · {0:N0} cached items · {1:F1}s",
        "CacheCreatedStatus": "Model cache created: {0:N0} items · {1:F1}s",
        "CacheFailedInline": "Game data was verified, but cache refresh failed: {0}",
        "CacheFailedStatus": "Model cache creation failed: {0}",
        "CacheNeedsCharacterIndex": "The character-making index was not found at {0}. Every model in the catalog is listed in that one file, so model search cannot work without it. Verify the game files in your launcher, then refresh.",
        "InvalidKeep": "The selected path is invalid; the existing path was kept: {0}",
        "Invalid": "The selected path is invalid: {0}",
        "GameFolderFailed": "Game folder setup failed: {0}",
        "RestoreFailed": "Saved data folder restore failed: {0}",
        "CharacterPickerTitle": "Open a PSO2 character shape file",
        "CharacterPickerType": "PSO2 character file",
        "AqmLoadTitle": "Open Shape Adjust AQM",
        "AqmFileType": "AQM motion",
        "AqmSaveTitle": "Save Shape Adjust AQM",
        "AqmSaved": "Saved {0} · {1:N0} adjusted bones",
        "AqmSaveFailed": "AQM save failed: {0}",
        "ShapeReset": "Shape Adjust was reset.",
        "ReadingFiles": "Reading files…",
        "ModelsCount": "{0:N0} models",
        "TexturesCount": "{0:N0} displayed textures",
        "IceDdsCount": "{0:N0} ICE DDS files",
        "IceEntriesCount": "{0:N0} ICE entries",
        "BonesCount": "{0:N0} bones",
        "CharacterBonesCount": "{0:N0} character bones",
        "AqmAdjustmentsCount": "{0:N0} AQM adjustments",
        "NoLoadableData": "No loadable data was found.",
        "LoadFailed": "Load failed: {0}",
        "AqnMissing": "A matching AQN file was not found beside the AQP file.",
        "QualityMissing": "file missing",
        "QualityHigh": "high quality",
        "QualityNormal": "normal quality",
        "UnnamedItem": "Unnamed {0}",
        "RendererReady": "OpenGL {0} ready",
        "RendererInitFailed": "OpenGL {0} initialization failed: {1}",
        "RendererRenderFailed": "OpenGL rendering failed: {0}",
        "RendererContextLost": "The OpenGL context was lost.",
        "FailedWord": "failed",
        "DataPathNotSelected": "No game folder was selected.",
        "DataPathInvalid": "The selected folder path cannot be used.",
        "DataPathFolderMissing": "The selected folder does not exist: {0}",
        "DataPathStructureMissing": "PSO2 data was not found. Select the game installation folder, pso2_bin, or pso2_bin\\data.",
        "DataPathFilesMissing": "win32/win32reboot exists but contains no game data files. Check that installation or patching is complete.",
        "DataPathAccessDenied": "The game data folder could not be accessed: {0}",
        "LanguageTip": "Interface language",
        "RemoveModel": "Remove model",
        "ModelRemoved": "Removed model: {0}",
        "SkinTextures": "Skin Textures",
        "SkinType1": "Type 1",
        "SkinType2": "Type 2",
        "SkinLoaded": "Skin loaded: {0} · {1}x{2}",
        "SkinLoadFailed": "Skin texture load failed: {0}",
        "ShapeUndone": "Undid the last shape edit.",
        "ShapeRedone": "Redid the shape edit.",
        "Options": "Options…",
        "OptionsTitle": "PSO2 Shape Studio Options",
        "General": "General",
        "GameDataFolder": "Game data folder",
        "Browse": "Browse…",
        "DefaultSkinColors": "Default skin colors",
        "MainSkinColor": "Main skin",
        "SubSkinColor": "Sub skin",
        "HexColorHelp": "Enter an sRGB color as six hexadecimal digits (RRGGBB). These colors are used when no character file is loaded.",
        "EditableBones": "Editable Bones",
        "BuiltInGroups": "Built-in groups",
        "CustomGroups": "Custom groups",
        "BoneEditorHelp": "Enable or hide built-in sliders. Custom groups edit either one bone or a mirrored L/R pair.",
        "AddPair": "Add L/R pair",
        "AddSingle": "Add single bone",
        "Remove": "Remove",
        "Pair": "L/R pair",
        "Single": "Single",
        "Kind": "Type",
        "GroupName": "Group name",
        "LeftBone": "Left bone",
        "RightBone": "Right bone",
        "BoneName": "Bone name",
        "Save": "Save",
        "Cancel": "Cancel",
        "ModelRequiredForBone": "Load a model with an AQN skeleton before adding editable bones.",
        "InvalidSkinColor": "Enter both skin colors as six hexadecimal digits.",
        "MissingBoneFields": "Each custom group needs a name and the required bone names.",
        "BoneNotFound": "The loaded skeleton does not contain this bone: {0}",
        "DuplicateBone": "Bone '{0}' is already assigned to another enabled group.",
        "OptionsSaved": "Options saved."
    },
    "shapeNames": {
        "bodyroot": "Sole Height (body_root Y)",
        "breast": "Breast",
        "breast2": "Breast Scale",
        "cbreast2": "Center Breast Scale",
        "clav": "Clavicle",
        "waist": "Waist",
        "hip": "Hip",
        "pelvis": "Pelvis",
        "hiptw": "Hip Twist",
        "thigh": "Thigh",
        "thightw": "Thigh Twist",
        "thightw2": "Thigh Twist 2",
        "calf0": "Calf Upper",
        "calf": "Calf",
        "foot": "Foot",
        "hand": "Hand"
    },
    "objectTypes": {
        "accessory": "Accessory",
        "basewear": "Basewear / Setwear",
        "costume": "Costume",
        "cast_body": "CAST Body",
        "bodypaint": "Body Paint",
        "cast_arms": "CAST Arms",
        "cast_legs": "CAST Legs",
        "ear": "Ears",
        "eye": "Eyes",
        "eyebrow": "Eyebrows",
        "eyelash": "Eyelashes",
        "face": "Face",
        "face_texture": "Face Type",
        "facepaint": "Face Paint",
        "hair": "Hair",
        "horn": "Horns",
        "innerwear": "Innerwear",
        "outerwear": "Outerwear",
        "skin": "Skin",
        "sticker": "Sticker",
        "teeth": "Teeth"
    }
}
