{
    "$schema": "./schema.json",
    "code": "ko",
    "name": "한국어",
    "order": 20,
    "strings": {
        "Subtitle": "PSO2 AQP/AQN 모델과 체형 파일을 편집합니다",
        "OpenModels": "모델 파일 열기…",
        "GameDataHeader": "게임 데이터 / 모델 검색",
        "SelectGameFolder": "게임 폴더 지정…",
        "RefreshCache": "캐시 갱신",
        "DataFolderUnspecified": "데이터 폴더 미지정",
        "DataFolderHelp": "게임 설치 폴더, pso2_bin 또는 data 폴더를 선택하세요.",
        "SearchPlaceholder": "이름 · ID · 파일명 · MD5",
        "Search": "검색",
        "LoadSelectedModel": "선택 모델 불러오기",
        "ShapeSliders": "체형 슬라이더 · S / P / R",
        "LoadCharacter": "캐릭터 파일 불러오기…",
        "LoadAqm": "_sa.aqm 불러오기…",
        "ResetShape": "체형 초기화",
        "SaveAqm": "_sa.aqm 저장…",
        "CameraHelp": "좌클릭 드래그: 카메라 회전   우클릭 드래그: 모델 회전   Ctrl+드래그: 상하 이동   휠클릭: 초기화   휠: 줌",
        "Ready": "준비",
        "Statistics": "모델 {0:N0} · 정점 {1:N0} · 삼각형 {2:N0} · 텍스처 {3:N0} · {4:F1} fps",
        "Scale": "스케일 (S)",
        "Position": "위치 (P)",
        "Rotation": "회전 (R)",
        "ModelPickerTitle": "PSO2 모델 파일 열기",
        "ModelPickerType": "PSO2 모델 / 골격 / ICE",
        "GameFolderPickerTitle": "PSO2 게임 설치 폴더 지정",
        "SearchResultCount": "검색 결과 {0:N0}개",
        "ModelSearchFailed": "모델 검색 실패: {0}",
        "WearBasewear": "베이스웨어",
        "WearOuterwear": "아웃터웨어",
        "WearSetwear": "세트웨어",
        "WearCostume": "코스튬(토탈)",
        "BackgroundTip": "뷰포트 배경색",
        "FloorGuide": "바닥 가이드",
        "FloorGuideTip": "월드 Y=0 바닥 가이드 표시",
        "Ornaments": "장식",
        "OrnamentsTip": "켜고 끌 수 있는 의상 장식 메시 표시",
        "BasewearOrnament1": "베이스웨어 장식 1",
        "BasewearOrnament2": "베이스웨어 장식 2",
        "OuterwearOrnament": "아우터웨어 장식",
        "BackgroundDark": "다크",
        "BackgroundGraphite": "그라파이트",
        "BackgroundGray": "그레이",
        "BackgroundSilver": "실버",
        "BackgroundWhite": "화이트",
        "BackgroundNavy": "네이비",
        "BackgroundForest": "포레스트",
        "BackgroundMagenta": "마젠타",
        "DataPathValid": "PSO2 게임 데이터 경로를 확인했습니다.",
        "CacheReadyInline": "게임 데이터 확인됨 · 캐시 {0:N0}건 준비",
        "CacheReadyStatus": "모델 캐시 {0:N0}건 준비",
        "DataPrepareFailedInline": "게임 데이터 경로는 확인했지만 설정 또는 캐시를 준비하지 못했습니다: {0}",
        "DataPrepareFailedStatus": "게임 데이터 준비 실패: {0}",
        "CacheUnavailable": "캐시를 갱신할 수 없습니다: {0}",
        "Refreshing": "갱신 중…",
        "CacheBuildingStatus": "CMX 모델 캐시를 생성하는 중…",
        "CacheBuildingInline": "게임 데이터 확인됨 · 모델 캐시를 갱신하는 중…",
        "CacheCompletedInline": "게임 데이터 확인됨 · 캐시 {0:N0}건 · {1:F1}초",
        "CacheCreatedStatus": "모델 캐시 {0:N0}건 생성 · {1:F1}초",
        "CacheFailedInline": "게임 데이터는 확인했지만 캐시 갱신에 실패했습니다: {0}",
        "CacheFailedStatus": "모델 캐시 생성 실패: {0}",
        "CacheNeedsCharacterIndex": "캐릭터 메이킹 인덱스를 {0} 에서 찾지 못했습니다. 카탈로그의 모든 모델이 이 파일 하나에 들어 있어서, 없으면 모델 검색이 동작하지 않습니다. 런처에서 게임 파일을 검사한 뒤 다시 갱신하세요.",
        "InvalidKeep": "선택한 경로가 올바르지 않아 기존 경로를 유지합니다: {0}",
        "Invalid": "경로가 올바르지 않습니다: {0}",
        "GameFolderFailed": "게임 폴더 설정 실패: {0}",
        "RestoreFailed": "저장된 데이터 폴더 복원 실패: {0}",
        "CharacterPickerTitle": "PSO2 캐릭터 체형 불러오기",
        "CharacterPickerType": "PSO2 캐릭터 파일",
        "AqmLoadTitle": "Shape Adjust AQM 불러오기",
        "AqmFileType": "AQM 모션",
        "AqmSaveTitle": "Shape Adjust AQM 저장",
        "AqmSaved": "{0} 저장 · {1:N0}개 본",
        "AqmSaveFailed": "AQM 저장 실패: {0}",
        "ShapeReset": "Shape Adjust를 초기화했습니다.",
        "ReadingFiles": "파일을 읽는 중…",
        "ModelsCount": "모델 {0:N0}개",
        "TexturesCount": "표시 텍스처 {0:N0}장",
        "IceDdsCount": "ICE DDS {0:N0}장",
        "IceEntriesCount": "ICE 항목 {0:N0}개",
        "BonesCount": "본 {0:N0}개",
        "CharacterBonesCount": "캐릭터 본 {0:N0}개",
        "AqmAdjustmentsCount": "AQM 조정 {0:N0}개",
        "NoLoadableData": "로드할 데이터가 없습니다.",
        "LoadFailed": "로드 실패: {0}",
        "AqnMissing": "AQP 옆에서 같은 이름의 AQN을 찾지 못했습니다.",
        "QualityMissing": "파일 없음",
        "QualityHigh": "고품질",
        "QualityNormal": "일반",
        "UnnamedItem": "이름 없음 {0}",
        "RendererReady": "OpenGL {0} 준비됨",
        "RendererInitFailed": "OpenGL {0} 초기화 실패: {1}",
        "RendererRenderFailed": "OpenGL 렌더 실패: {0}",
        "RendererContextLost": "OpenGL 컨텍스트를 잃었습니다.",
        "FailedWord": "실패",
        "DataPathNotSelected": "게임 폴더가 선택되지 않았습니다.",
        "DataPathInvalid": "사용할 수 없는 폴더 경로입니다.",
        "DataPathFolderMissing": "선택한 폴더가 존재하지 않습니다: {0}",
        "DataPathStructureMissing": "PSO2 데이터 폴더를 찾지 못했습니다. 게임 설치 폴더, pso2_bin 또는 pso2_bin\\data를 선택하세요.",
        "DataPathFilesMissing": "win32/win32reboot 폴더는 있지만 실제 게임 데이터 파일이 없습니다. 설치 또는 패치가 완료됐는지 확인하세요.",
        "DataPathAccessDenied": "게임 데이터 폴더에 접근할 수 없습니다: {0}",
        "LanguageTip": "인터페이스 언어",
        "RemoveModel": "모델 삭제",
        "ModelRemoved": "모델 삭제: {0}",
        "SkinTextures": "피부 텍스처",
        "SkinType1": "타입 1",
        "SkinType2": "타입 2",
        "SkinLoaded": "피부 불러옴: {0} · {1}x{2}",
        "SkinLoadFailed": "피부 텍스처 불러오기 실패: {0}",
        "ShapeUndone": "마지막 체형 편집을 되돌렸습니다.",
        "ShapeRedone": "체형 편집을 다시 적용했습니다.",
        "Options": "옵션…",
        "OptionsTitle": "PSO2 Shape Studio 옵션",
        "General": "일반",
        "GameDataFolder": "게임 데이터 폴더",
        "Browse": "찾아보기…",
        "DefaultSkinColors": "기본 피부색",
        "MainSkinColor": "주 피부색",
        "SubSkinColor": "보조 피부색",
        "HexColorHelp": "sRGB 색상을 6자리 16진수(RRGGBB)로 입력하세요. 캐릭터 파일을 불러오지 않았을 때 적용됩니다.",
        "EditableBones": "편집 가능한 본",
        "BuiltInGroups": "기본 그룹",
        "CustomGroups": "사용자 그룹",
        "BoneEditorHelp": "기본 슬라이더를 표시하거나 숨기고, 단일 본 또는 좌우 대칭 L/R 묶음을 추가할 수 있습니다.",
        "AddPair": "L/R 묶음 추가",
        "AddSingle": "단일 본 추가",
        "Remove": "삭제",
        "Pair": "L/R 묶음",
        "Single": "단일",
        "Kind": "종류",
        "GroupName": "그룹 이름",
        "LeftBone": "왼쪽 본",
        "RightBone": "오른쪽 본",
        "BoneName": "본 이름",
        "Save": "저장",
        "Cancel": "취소",
        "ModelRequiredForBone": "편집할 본을 추가하려면 AQN 스켈레톤이 포함된 모델을 먼저 불러오세요.",
        "InvalidSkinColor": "두 피부색을 모두 6자리 16진수로 입력하세요.",
        "MissingBoneFields": "사용자 그룹에는 그룹 이름과 필요한 본 이름을 모두 입력해야 합니다.",
        "BoneNotFound": "현재 스켈레톤에 없는 본입니다: {0}",
        "DuplicateBone": "본 '{0}'은(는) 이미 다른 활성 그룹에 지정되어 있습니다.",
        "OptionsSaved": "옵션을 저장했습니다.",
        "DemoLighting": "데모 조명 미리보기"
    },
    "shapeNames": {
        "bodyroot": "발바닥 높이 (body_root Y)",
        "breast": "가슴",
        "breast2": "가슴 스케일",
        "cbreast2": "중앙 가슴 스케일",
        "clav": "쇄골",
        "waist": "허리",
        "hip": "엉덩이",
        "pelvis": "골반",
        "hiptw": "엉덩이 비틀기",
        "thigh": "허벅지",
        "thightw": "허벅지 비틀기",
        "thightw2": "허벅지 비틀기 2",
        "calf0": "종아리 위쪽",
        "calf": "종아리",
        "foot": "발",
        "hand": "손"
    },
    "objectTypes": {
        "accessory": "액세서리",
        "basewear": "베이스웨어 / 세트웨어",
        "costume": "코스튬",
        "cast_body": "캐스트 바디",
        "bodypaint": "바디 페인트",
        "cast_arms": "캐스트 암",
        "cast_legs": "캐스트 레그",
        "ear": "귀",
        "eye": "눈",
        "eyebrow": "눈썹",
        "eyelash": "속눈썹",
        "face": "얼굴",
        "face_texture": "얼굴형",
        "facepaint": "페이스 페인트",
        "hair": "헤어",
        "horn": "뿔",
        "innerwear": "이너웨어",
        "outerwear": "아우터웨어",
        "skin": "스킨",
        "sticker": "스티커",
        "teeth": "치아"
    }
}
