{
    "$schema": "./schema.json",
    "code": "ja",
    "name": "日本語",
    "order": 10,
    "strings": {
        "Subtitle": "PSO2のAQP/AQNモデルと体型ファイルを編集します",
        "OpenModels": "モデルファイルを開く…",
        "GameDataHeader": "ゲームデータ / モデル検索",
        "SelectGameFolder": "ゲームフォルダーを選択…",
        "RefreshCache": "キャッシュ更新",
        "DataFolderUnspecified": "データフォルダー未選択",
        "DataFolderHelp": "ゲームのインストール先、pso2_bin、またはdataフォルダーを選択してください。",
        "SearchPlaceholder": "名前 · ID · ファイル名 · MD5",
        "Search": "検索",
        "LoadSelectedModel": "選択したモデルを読み込む",
        "ShapeSliders": "体型スライダー · S / P / R",
        "LoadCharacter": "キャラクターファイルを開く…",
        "LoadAqm": "_sa.aqmを開く…",
        "ResetShape": "体型をリセット",
        "SaveAqm": "_sa.aqmを保存…",
        "CameraHelp": "左ドラッグ：カメラ回転   右ドラッグ：モデル回転   Ctrl+ドラッグ：上下移動   中クリック：リセット   ホイール：ズーム",
        "Ready": "準備完了",
        "Statistics": "モデル {0:N0} · 頂点 {1:N0} · 三角形 {2:N0} · テクスチャ {3:N0} · {4:F1} fps",
        "Scale": "スケール (S)",
        "Position": "位置 (P)",
        "Rotation": "回転 (R)",
        "ModelPickerTitle": "PSO2モデルファイルを開く",
        "ModelPickerType": "PSO2モデル / スケルトン / ICE",
        "GameFolderPickerTitle": "PSO2ゲームのインストール先を選択",
        "SearchResultCount": "検索結果 {0:N0}件",
        "ModelSearchFailed": "モデル検索に失敗しました：{0}",
        "WearBasewear": "ベースウェア",
        "WearOuterwear": "アウターウェア",
        "WearSetwear": "セットウェア",
        "WearCostume": "コスチューム",
        "BackgroundTip": "ビューポート背景色",
        "FloorGuide": "床ガイド",
        "FloorGuideTip": "ワールドY=0の床ガイドを表示",
        "Ornaments": "装飾",
        "OrnamentsTip": "表示切替に対応したウェア装飾メッシュを表示します",
        "BasewearOrnament1": "ベースウェア装飾1",
        "BasewearOrnament2": "ベースウェア装飾2",
        "OuterwearOrnament": "アウターウェア装飾",
        "BackgroundDark": "ダーク",
        "BackgroundGraphite": "グラファイト",
        "BackgroundGray": "グレー",
        "BackgroundSilver": "シルバー",
        "BackgroundWhite": "ホワイト",
        "BackgroundNavy": "ネイビー",
        "BackgroundForest": "フォレスト",
        "BackgroundMagenta": "マゼンタ",
        "DataPathValid": "PSO2ゲームデータを確認しました。",
        "CacheReadyInline": "ゲームデータ確認済み · キャッシュ {0:N0}件",
        "CacheReadyStatus": "モデルキャッシュ {0:N0}件を準備しました",
        "DataPrepareFailedInline": "ゲームデータは確認できましたが、設定またはキャッシュの準備に失敗しました：{0}",
        "DataPrepareFailedStatus": "ゲームデータの準備に失敗しました：{0}",
        "CacheUnavailable": "キャッシュを更新できません：{0}",
        "Refreshing": "更新中…",
        "CacheBuildingStatus": "CMXモデルキャッシュを作成中…",
        "CacheBuildingInline": "ゲームデータ確認済み · モデルキャッシュを更新中…",
        "CacheCompletedInline": "ゲームデータ確認済み · キャッシュ {0:N0}件 · {1:F1}秒",
        "CacheCreatedStatus": "モデルキャッシュ {0:N0}件を作成 · {1:F1}秒",
        "CacheFailedInline": "ゲームデータは確認できましたが、キャッシュ更新に失敗しました：{0}",
        "CacheFailedStatus": "モデルキャッシュの作成に失敗しました：{0}",
        "CacheNeedsCharacterIndex": "キャラクタークリエイトのインデックスが {0} に見つかりませんでした。カタログのすべてのモデルはこのファイルに記載されているため、これがないとモデル検索は動作しません。ランチャーでゲームファイルを確認してから、更新してください。",
        "InvalidKeep": "選択したパスが正しくないため、現在のパスを維持します：{0}",
        "Invalid": "選択したパスが正しくありません：{0}",
        "GameFolderFailed": "ゲームフォルダーの設定に失敗しました：{0}",
        "RestoreFailed": "保存されたデータフォルダーの復元に失敗しました：{0}",
        "CharacterPickerTitle": "PSO2キャラクター体型ファイルを開く",
        "CharacterPickerType": "PSO2キャラクターファイル",
        "AqmLoadTitle": "Shape Adjust AQMを開く",
        "AqmFileType": "AQMモーション",
        "AqmSaveTitle": "Shape Adjust AQMを保存",
        "AqmSaved": "{0}を保存 · 調整ボーン {1:N0}個",
        "AqmSaveFailed": "AQMの保存に失敗しました：{0}",
        "ShapeReset": "Shape Adjustをリセットしました。",
        "ReadingFiles": "ファイルを読み込み中…",
        "ModelsCount": "モデル {0:N0}個",
        "TexturesCount": "表示テクスチャ {0:N0}枚",
        "IceDdsCount": "ICE DDS {0:N0}枚",
        "IceEntriesCount": "ICE項目 {0:N0}件",
        "BonesCount": "ボーン {0:N0}本",
        "CharacterBonesCount": "キャラクターボーン {0:N0}本",
        "AqmAdjustmentsCount": "AQM調整 {0:N0}件",
        "NoLoadableData": "読み込み可能なデータがありません。",
        "LoadFailed": "読み込みに失敗しました：{0}",
        "AqnMissing": "AQPと同名のAQNファイルが見つかりません。",
        "QualityMissing": "ファイルなし",
        "QualityHigh": "高品質",
        "QualityNormal": "通常",
        "UnnamedItem": "名称不明 {0}",
        "RendererReady": "OpenGL {0} 準備完了",
        "RendererInitFailed": "OpenGL {0} の初期化に失敗しました：{1}",
        "RendererRenderFailed": "OpenGL描画に失敗しました：{0}",
        "RendererContextLost": "OpenGLコンテキストが失われました。",
        "FailedWord": "失敗",
        "DataPathNotSelected": "ゲームフォルダーが選択されていません。",
        "DataPathInvalid": "選択したフォルダーパスは使用できません。",
        "DataPathFolderMissing": "選択したフォルダーが存在しません：{0}",
        "DataPathStructureMissing": "PSO2データが見つかりません。ゲームのインストール先、pso2_bin、またはpso2_bin\\dataを選択してください。",
        "DataPathFilesMissing": "win32/win32rebootはありますが、ゲームデータファイルがありません。インストールまたはパッチの完了を確認してください。",
        "DataPathAccessDenied": "ゲームデータフォルダーにアクセスできません：{0}",
        "LanguageTip": "表示言語",
        "RemoveModel": "モデルを削除",
        "ModelRemoved": "モデルを削除しました：{0}",
        "SkinTextures": "スキンテクスチャ",
        "SkinType1": "タイプ1",
        "SkinType2": "タイプ2",
        "SkinLoaded": "スキンを読み込みました：{0} · {1}x{2}",
        "SkinLoadFailed": "スキンテクスチャの読み込みに失敗しました：{0}",
        "ShapeUndone": "直前の体型編集を元に戻しました。",
        "ShapeRedone": "体型編集をやり直しました。",
        "Options": "オプション…",
        "OptionsTitle": "PSO2 Shape Studio オプション",
        "General": "一般",
        "GameDataFolder": "ゲームデータフォルダー",
        "Browse": "参照…",
        "DefaultSkinColors": "デフォルトの肌カラー",
        "MainSkinColor": "メイン肌カラー",
        "SubSkinColor": "サブ肌カラー",
        "HexColorHelp": "sRGBカラーを6桁の16進数（RRGGBB）で入力します。キャラクターファイル未読込時に使用されます。",
        "EditableBones": "編集可能なボーン",
        "BuiltInGroups": "標準グループ",
        "CustomGroups": "カスタムグループ",
        "BoneEditorHelp": "標準スライダーの表示を切り替え、単一ボーンまたは左右対称のL/Rペアを追加できます。",
        "AddPair": "L/Rペアを追加",
        "AddSingle": "単一ボーンを追加",
        "Remove": "削除",
        "Pair": "L/Rペア",
        "Single": "単一",
        "Kind": "種類",
        "GroupName": "グループ名",
        "LeftBone": "左ボーン",
        "RightBone": "右ボーン",
        "BoneName": "ボーン名",
        "Save": "保存",
        "Cancel": "キャンセル",
        "ModelRequiredForBone": "編集ボーンを追加するには、AQNスケルトンを含むモデルを先に読み込んでください。",
        "InvalidSkinColor": "肌カラーを両方とも6桁の16進数で入力してください。",
        "MissingBoneFields": "カスタムグループにはグループ名と必要なボーン名を入力してください。",
        "BoneNotFound": "現在のスケルトンに存在しないボーンです：{0}",
        "DuplicateBone": "ボーン「{0}」は別の有効なグループに割り当て済みです。",
        "OptionsSaved": "オプションを保存しました。",
        "DemoLighting": "デモ照明プレビュー"
    },
    "shapeNames": {
        "bodyroot": "足裏の高さ (body_root Y)",
        "breast": "胸",
        "breast2": "胸スケール",
        "cbreast2": "中央胸スケール",
        "clav": "鎖骨",
        "waist": "ウエスト",
        "hip": "ヒップ",
        "pelvis": "骨盤",
        "hiptw": "ヒップツイスト",
        "thigh": "太もも",
        "thightw": "太ももツイスト",
        "thightw2": "太ももツイスト2",
        "calf0": "ふくらはぎ上部",
        "calf": "ふくらはぎ",
        "foot": "足",
        "hand": "手"
    },
    "objectTypes": {
        "accessory": "アクセサリー",
        "basewear": "ベースウェア / セットウェア",
        "costume": "コスチューム",
        "cast_body": "キャストボディ",
        "bodypaint": "ボディペイント",
        "cast_arms": "キャストアーム",
        "cast_legs": "キャストレッグ",
        "ear": "耳",
        "eye": "瞳",
        "eyebrow": "まゆ",
        "eyelash": "まつげ",
        "face": "顔",
        "face_texture": "顔タイプ",
        "facepaint": "フェイスペイント",
        "hair": "ヘア",
        "horn": "角",
        "innerwear": "インナーウェア",
        "outerwear": "アウターウェア",
        "skin": "スキン",
        "sticker": "ステッカー",
        "teeth": "歯"
    }
}
