{
    "$schema": "./schema.json",
    "code": "zh-Hant",
    "name": "繁體中文",
    "order": 30,
    "strings": {
        "Subtitle": "編輯 PSO2 AQP/AQN 模型與角色體型",
        "OpenModels": "開啟模型檔案…",
        "GameDataHeader": "遊戲資料 / 模型搜尋",
        "SelectGameFolder": "選擇遊戲資料夾…",
        "RefreshCache": "重新整理快取",
        "DataFolderUnspecified": "尚未選擇遊戲資料夾",
        "DataFolderHelp": "請選擇遊戲安裝資料夾、pso2_bin 或 data 資料夾。",
        "SearchPlaceholder": "名稱 · ID · 檔名 · MD5",
        "Search": "搜尋",
        "LoadSelectedModel": "載入選取的模型",
        "ShapeSliders": "體型滑桿 · S / P / R",
        "LoadCharacter": "載入角色檔案…",
        "LoadAqm": "載入 _sa.aqm…",
        "ResetShape": "重設體型",
        "SaveAqm": "儲存 _sa.aqm…",
        "CameraHelp": "左鍵拖曳：旋轉鏡頭   右鍵拖曳：旋轉模型   Ctrl+拖曳：垂直移動   中鍵：重設   滾輪：縮放",
        "Ready": "就緒",
        "Statistics": "模型 {0:N0} · 頂點 {1:N0} · 三角形 {2:N0} · 貼圖 {3:N0} · {4:F1} fps",
        "Scale": "縮放 (S)",
        "Position": "位置 (P)",
        "Rotation": "旋轉 (R)",
        "ModelPickerTitle": "開啟 PSO2 模型檔案",
        "ModelPickerType": "PSO2 模型 / 骨架 / ICE",
        "GameFolderPickerTitle": "選擇 PSO2 遊戲安裝資料夾",
        "SearchResultCount": "{0:N0} 筆搜尋結果",
        "ModelSearchFailed": "模型搜尋失敗：{0}",
        "WearBasewear": "基底服",
        "WearOuterwear": "外套",
        "WearSetwear": "套裝",
        "WearCostume": "服裝（舊版）",
        "BackgroundTip": "檢視區背景",
        "FloorGuide": "地面參考線",
        "FloorGuideTip": "顯示世界座標 Y=0 的地面參考線",
        "Ornaments": "裝飾",
        "OrnamentsTip": "顯示或隱藏可切換的服裝裝飾網格",
        "BasewearOrnament1": "基底服裝飾 1",
        "BasewearOrnament2": "基底服裝飾 2",
        "OuterwearOrnament": "外套裝飾",
        "BackgroundDark": "深色",
        "BackgroundGraphite": "石墨灰",
        "BackgroundGray": "灰色",
        "BackgroundSilver": "銀色",
        "BackgroundWhite": "白色",
        "BackgroundNavy": "海軍藍",
        "BackgroundForest": "森林綠",
        "BackgroundMagenta": "洋紅色",
        "DataPathValid": "已驗證 PSO2 遊戲資料路徑。",
        "CacheReadyInline": "遊戲資料已驗證 · {0:N0} 筆快取項目已就緒",
        "CacheReadyStatus": "模型快取已就緒：{0:N0} 筆",
        "DataPrepareFailedInline": "遊戲資料路徑有效，但設定或快取準備失敗：{0}",
        "DataPrepareFailedStatus": "遊戲資料準備失敗：{0}",
        "CacheUnavailable": "無法重新整理快取：{0}",
        "Refreshing": "正在重新整理…",
        "CacheBuildingStatus": "正在建立 CMX 模型快取…",
        "CacheBuildingInline": "遊戲資料已驗證 · 正在重新整理模型快取…",
        "CacheCompletedInline": "遊戲資料已驗證 · {0:N0} 筆快取項目 · {1:F1} 秒",
        "CacheCreatedStatus": "模型快取已建立：{0:N0} 筆 · {1:F1} 秒",
        "CacheFailedInline": "遊戲資料已驗證，但重新整理快取失敗：{0}",
        "CacheFailedStatus": "建立模型快取失敗：{0}",
        "CacheNeedsCharacterIndex": "未在 {0} 找到角色創建索引。型錄中的所有模型都記錄在這一個檔案裡，缺少它就無法進行模型搜尋。請在啟動器中檢查遊戲檔案後再重新整理。",
        "InvalidKeep": "選取的路徑無效；已保留原有路徑：{0}",
        "Invalid": "選取的路徑無效：{0}",
        "GameFolderFailed": "設定遊戲資料夾失敗：{0}",
        "RestoreFailed": "還原已儲存的資料路徑失敗：{0}",
        "CharacterPickerTitle": "開啟 PSO2 角色體型檔案",
        "CharacterPickerType": "PSO2 角色檔案",
        "AqmLoadTitle": "開啟體型調整 AQM",
        "AqmFileType": "AQM 動作檔",
        "AqmSaveTitle": "儲存體型調整 AQM",
        "AqmSaved": "已儲存 {0} · 已調整 {1:N0} 個骨骼",
        "AqmSaveFailed": "AQM 儲存失敗：{0}",
        "ShapeReset": "已重設體型調整。",
        "ReadingFiles": "正在讀取檔案…",
        "ModelsCount": "{0:N0} 個模型",
        "TexturesCount": "顯示 {0:N0} 張貼圖",
        "IceDdsCount": "{0:N0} 個 ICE DDS 檔案",
        "IceEntriesCount": "{0:N0} 個 ICE 項目",
        "BonesCount": "{0:N0} 個骨骼",
        "CharacterBonesCount": "{0:N0} 個角色骨骼",
        "AqmAdjustmentsCount": "{0:N0} 個 AQM 調整",
        "NoLoadableData": "找不到可載入的資料。",
        "LoadFailed": "載入失敗：{0}",
        "AqnMissing": "在 AQP 檔案旁找不到相符的 AQN 檔案。",
        "QualityMissing": "檔案遺失",
        "QualityHigh": "高品質",
        "QualityNormal": "一般品質",
        "UnnamedItem": "未命名 {0}",
        "RendererReady": "OpenGL {0} 已就緒",
        "RendererInitFailed": "OpenGL {0} 初始化失敗：{1}",
        "RendererRenderFailed": "OpenGL 彩現失敗：{0}",
        "RendererContextLost": "OpenGL 繪圖環境已遺失。",
        "FailedWord": "失敗",
        "DataPathNotSelected": "尚未選擇遊戲資料夾。",
        "DataPathInvalid": "無法使用選取的資料夾路徑。",
        "DataPathFolderMissing": "選取的資料夾不存在：{0}",
        "DataPathStructureMissing": "找不到 PSO2 資料。請選擇遊戲安裝資料夾、pso2_bin 或 pso2_bin\\data。",
        "DataPathFilesMissing": "win32/win32reboot 存在，但其中沒有遊戲資料檔案。請確認安裝或更新已完成。",
        "DataPathAccessDenied": "無法存取遊戲資料夾：{0}",
        "LanguageTip": "介面語言",
        "RemoveModel": "移除模型",
        "ModelRemoved": "已移除模型：{0}",
        "SkinTextures": "皮膚貼圖",
        "SkinType1": "類型 1",
        "SkinType2": "類型 2",
        "SkinLoaded": "已載入皮膚：{0} · {1}x{2}",
        "SkinLoadFailed": "載入皮膚貼圖失敗：{0}",
        "ShapeUndone": "已復原上一個體型編輯。",
        "ShapeRedone": "已重做體型編輯。",
        "Options": "選項…",
        "OptionsTitle": "PSO2 Shape Studio 選項",
        "General": "一般",
        "GameDataFolder": "遊戲資料位置",
        "Browse": "瀏覽…",
        "DefaultSkinColors": "預設膚色",
        "MainSkinColor": "主要膚色",
        "SubSkinColor": "次要膚色",
        "HexColorHelp": "請以六位十六進位數字（RRGGBB）輸入 sRGB 色彩。未載入角色檔案時會使用這些色彩。",
        "EditableBones": "可編輯骨骼",
        "BuiltInGroups": "內建群組",
        "CustomGroups": "自訂群組",
        "BoneEditorHelp": "啟用或隱藏內建滑桿。自訂群組可編輯單一骨骼或鏡像的左/右骨骼配對。",
        "AddPair": "新增左/右配對",
        "AddSingle": "新增單一骨骼",
        "Remove": "移除",
        "Pair": "左/右配對",
        "Single": "單一",
        "Kind": "類型",
        "GroupName": "群組名稱",
        "LeftBone": "左側骨骼",
        "RightBone": "右側骨骼",
        "BoneName": "骨骼名稱",
        "Save": "儲存",
        "Cancel": "取消",
        "ModelRequiredForBone": "新增可編輯骨骼前，請先載入含有 AQN 骨架的模型。",
        "InvalidSkinColor": "請將兩個膚色都輸入為六位十六進位數字。",
        "MissingBoneFields": "每個自訂群組都需要名稱及必要的骨骼名稱。",
        "BoneNotFound": "載入的骨架不包含此骨骼：{0}",
        "DuplicateBone": "骨骼「{0}」已指派給另一個啟用中的群組。",
        "OptionsSaved": "選項已儲存。",
        "DemoLighting": "示範光照預覽"
    },
    "shapeNames": {
        "bodyroot": "腳底高度 (body_root Y)",
        "breast": "胸部",
        "breast2": "胸部縮放",
        "cbreast2": "中央胸部縮放",
        "clav": "鎖骨",
        "waist": "腰部",
        "hip": "臀部",
        "pelvis": "骨盆",
        "hiptw": "臀部扭轉",
        "thigh": "大腿",
        "thightw": "大腿扭轉",
        "thightw2": "大腿扭轉 2",
        "calf0": "小腿上部",
        "calf": "小腿",
        "foot": "足部",
        "hand": "手"
    },
    "objectTypes": {
        "accessory": "飾品",
        "basewear": "基底服 / 套裝",
        "costume": "服裝",
        "cast_body": "CAST 身體",
        "bodypaint": "身體彩繪",
        "cast_arms": "CAST 手臂",
        "cast_legs": "CAST 腿部",
        "ear": "耳朵",
        "eye": "眼睛",
        "eyebrow": "眉毛",
        "eyelash": "睫毛",
        "face": "臉部",
        "face_texture": "臉型",
        "facepaint": "臉部彩繪",
        "hair": "髮型",
        "horn": "角",
        "innerwear": "貼身衣",
        "outerwear": "外套",
        "skin": "皮膚",
        "sticker": "貼紙",
        "teeth": "牙齒"
    }
}
