{
    "$schema": "./schema.json",
    "code": "zh-Hans",
    "name": "简体中文",
    "order": 25,
    "strings": {
        "Subtitle": "编辑 PSO2 AQP/AQN 模型与角色体型",
        "OpenModels": "打开模型文件…",
        "GameDataHeader": "游戏数据 / 模型搜索",
        "SelectGameFolder": "选择游戏文件夹…",
        "RefreshCache": "刷新缓存",
        "DataFolderUnspecified": "尚未选择游戏文件夹",
        "DataFolderHelp": "请选择游戏安装文件夹、pso2_bin 或 data 文件夹。",
        "SearchPlaceholder": "名称 · ID · 文件名 · MD5",
        "Search": "搜索",
        "LoadSelectedModel": "加载选中的模型",
        "ShapeSliders": "体型滑块 · S / P / R",
        "LoadCharacter": "加载角色文件…",
        "LoadAqm": "加载 _sa.aqm…",
        "ResetShape": "重置体型",
        "SaveAqm": "保存 _sa.aqm…",
        "CameraHelp": "左/右键拖动：旋转   Ctrl+拖动：垂直移动   中键：重置视角   滚轮：缩放",
        "Ready": "就绪",
        "Statistics": "模型 {0:N0} · 顶点 {1:N0} · 三角形 {2:N0} · 贴图 {3:N0} · {4:F1} fps",
        "Scale": "缩放 (S)",
        "Position": "位置 (P)",
        "Rotation": "旋转 (R)",
        "ModelPickerTitle": "打开 PSO2 模型文件",
        "ModelPickerType": "PSO2 模型 / 骨架 / ICE",
        "GameFolderPickerTitle": "选择 PSO2 游戏安装文件夹",
        "SearchResultCount": "{0:N0} 条搜索结果",
        "ModelSearchFailed": "模型搜索失败：{0}",
        "WearBasewear": "基础服",
        "WearOuterwear": "外套",
        "WearSetwear": "套装",
        "WearCostume": "服装（旧版）",
        "BackgroundTip": "视口背景",
        "FloorGuide": "地面参考线",
        "FloorGuideTip": "显示世界坐标 Y=0 的地面参考线",
        "Ornaments": "装饰",
        "OrnamentsTip": "显示或隐藏可切换的服装装饰网格",
        "BasewearOrnament1": "基础服装饰 1",
        "BasewearOrnament2": "基础服装饰 2",
        "OuterwearOrnament": "外套装饰",
        "BackgroundDark": "深色",
        "BackgroundGraphite": "石墨灰",
        "BackgroundGray": "灰色",
        "BackgroundSilver": "银色",
        "BackgroundWhite": "白色",
        "BackgroundNavy": "海军蓝",
        "BackgroundForest": "森林绿",
        "BackgroundMagenta": "洋红色",
        "DataPathValid": "已验证 PSO2 游戏数据路径。",
        "CacheReadyInline": "游戏数据已验证 · {0:N0} 条缓存条目已就绪",
        "CacheReadyStatus": "模型缓存已就绪：{0:N0} 条",
        "DataPrepareFailedInline": "游戏数据路径有效，但设置或缓存准备失败：{0}",
        "DataPrepareFailedStatus": "游戏数据准备失败：{0}",
        "CacheUnavailable": "无法刷新缓存：{0}",
        "Refreshing": "正在刷新…",
        "CacheBuildingStatus": "正在创建 CMX 模型缓存…",
        "CacheBuildingInline": "游戏数据已验证 · 正在刷新模型缓存…",
        "CacheCompletedInline": "游戏数据已验证 · {0:N0} 条缓存条目 · {1:F1} 秒",
        "CacheCreatedStatus": "模型缓存已创建：{0:N0} 条 · {1:F1} 秒",
        "CacheFailedInline": "游戏数据已验证，但刷新缓存失败：{0}",
        "CacheFailedStatus": "创建模型缓存失败：{0}",
        "CacheNeedsCharacterIndex": "未在 {0} 找到角色创建索引。目录中的所有模型都记录在这一个文件里，缺少它则无法进行模型搜索。请在启动器中检查游戏文件后再刷新。",
        "InvalidKeep": "选择的路径无效；已保留原有路径：{0}",
        "Invalid": "选择的路径无效：{0}",
        "GameFolderFailed": "设置游戏文件夹失败：{0}",
        "RestoreFailed": "恢复已保存的数据路径失败：{0}",
        "CharacterPickerTitle": "打开 PSO2 角色体型文件",
        "CharacterPickerType": "PSO2 角色文件",
        "AqmLoadTitle": "打开体型调整 AQM",
        "AqmFileType": "AQM 动作文件",
        "AqmSaveTitle": "保存体型调整 AQM",
        "AqmSaved": "已保存 {0} · 已调整 {1:N0} 根骨骼",
        "AqmSaveFailed": "AQM 保存失败：{0}",
        "ShapeReset": "已重置体型调整。",
        "ReadingFiles": "正在读取文件…",
        "ModelsCount": "{0:N0} 个模型",
        "TexturesCount": "显示 {0:N0} 张贴图",
        "IceDdsCount": "{0:N0} 个 ICE DDS 文件",
        "IceEntriesCount": "{0:N0} 个 ICE 条目",
        "BonesCount": "{0:N0} 根骨骼",
        "CharacterBonesCount": "{0:N0} 根角色骨骼",
        "AqmAdjustmentsCount": "{0:N0} 个 AQM 调整",
        "NoLoadableData": "找不到可加载的数据。",
        "LoadFailed": "加载失败：{0}",
        "AqnMissing": "在 AQP 文件旁找不到匹配的 AQN 文件。",
        "QualityMissing": "文件缺失",
        "QualityHigh": "高质量",
        "QualityNormal": "普通质量",
        "UnnamedItem": "未命名 {0}",
        "RendererReady": "OpenGL {0} 已就绪",
        "RendererInitFailed": "OpenGL {0} 初始化失败：{1}",
        "RendererRenderFailed": "OpenGL 渲染失败：{0}",
        "RendererContextLost": "OpenGL 上下文已丢失。",
        "FailedWord": "失败",
        "DataPathNotSelected": "尚未选择游戏文件夹。",
        "DataPathInvalid": "无法使用选择的文件夹路径。",
        "DataPathFolderMissing": "选择的文件夹不存在：{0}",
        "DataPathStructureMissing": "找不到 PSO2 数据。请选择游戏安装文件夹、pso2_bin 或 pso2_bin\\data。",
        "DataPathFilesMissing": "win32/win32reboot 存在，但其中没有游戏数据文件。请确认安装或更新已完成。",
        "DataPathAccessDenied": "无法访问游戏文件夹：{0}",
        "LanguageTip": "界面语言",
        "RemoveModel": "移除模型",
        "ModelRemoved": "已移除模型：{0}",
        "SkinTextures": "皮肤贴图",
        "SkinType1": "类型 1",
        "SkinType2": "类型 2",
        "SkinLoaded": "已加载皮肤：{0} · {1}x{2}",
        "SkinLoadFailed": "加载皮肤贴图失败：{0}",
        "ShapeUndone": "已撤销上一次体型编辑。",
        "ShapeRedone": "已重做体型编辑。",
        "Options": "选项…",
        "OptionsTitle": "PSO2 Shape Studio 选项",
        "General": "常规",
        "GameDataFolder": "游戏数据位置",
        "Browse": "浏览…",
        "DefaultSkinColors": "默认肤色",
        "MainSkinColor": "主肤色",
        "SubSkinColor": "副肤色",
        "HexColorHelp": "请以六位十六进制数字（RRGGBB）输入 sRGB 颜色。未加载角色文件时会使用这些颜色。",
        "EditableBones": "可编辑骨骼",
        "BuiltInGroups": "内置分组",
        "CustomGroups": "自定义分组",
        "BoneEditorHelp": "启用或隐藏内置滑块。自定义分组可编辑单根骨骼或镜像的左/右骨骼配对。",
        "AddPair": "添加左/右配对",
        "AddSingle": "添加单根骨骼",
        "Remove": "移除",
        "Pair": "左/右配对",
        "Single": "单根",
        "Kind": "类型",
        "GroupName": "分组名称",
        "LeftBone": "左侧骨骼",
        "RightBone": "右侧骨骼",
        "BoneName": "骨骼名称",
        "Save": "保存",
        "Cancel": "取消",
        "ModelRequiredForBone": "添加可编辑骨骼前，请先加载带 AQN 骨架的模型。",
        "InvalidSkinColor": "请将两个肤色都输入为六位十六进制数字。",
        "MissingBoneFields": "每个自定义分组都需要名称及必要的骨骼名称。",
        "BoneNotFound": "加载的骨架不包含此骨骼：{0}",
        "DuplicateBone": "骨骼「{0}」已分配给另一个启用中的分组。",
        "OptionsSaved": "选项已保存。"
    },
    "shapeNames": {
        "bodyroot": "脚底高度 (body_root Y)",
        "breast": "胸部",
        "breast2": "胸部缩放",
        "cbreast2": "中央胸部缩放",
        "clav": "锁骨",
        "waist": "腰部",
        "hip": "臀部",
        "pelvis": "骨盆",
        "hiptw": "臀部扭转",
        "thigh": "大腿",
        "thightw": "大腿扭转",
        "thightw2": "大腿扭转 2",
        "calf0": "小腿上部",
        "calf": "小腿",
        "foot": "足部",
        "hand": "手"
    },
    "objectTypes": {
        "accessory": "饰品",
        "basewear": "基础服 / 套装",
        "costume": "服装",
        "cast_body": "CAST 身体",
        "bodypaint": "身体彩绘",
        "cast_arms": "CAST 手臂",
        "cast_legs": "CAST 腿部",
        "ear": "耳朵",
        "eye": "眼睛",
        "eyebrow": "眉毛",
        "eyelash": "睫毛",
        "face": "脸部",
        "face_texture": "脸型",
        "facepaint": "面部彩绘",
        "hair": "发型",
        "horn": "角",
        "innerwear": "内衣",
        "skin": "皮肤",
        "outerwear": "外套",
        "sticker": "贴纸",
        "teeth": "牙齿"
    }
}
